{
  "critical_code": [
    "pilot/diagnostics/zero_training_pilot_readme.md",
    "pilot/returns/return_closure_manifest.md"
  ],
  "data_manifest_id": "zero-training-pilot-no-data-manifest",
  "data_manifest_sha256": "9109d1b373bf3667828788a0198495ee684f9408d15aefecc101b562ecc43cfc",
  "experiment_id": "gitee_roundtrip_pilot_w006_v001_20260810",
  "external_eval_policy": {
    "mode": "none",
    "note": "zero-training pilot: no external eval"
  },
  "feature_flags": {
    "diagnostic_only": true,
    "result_import_blocked": true,
    "zero_training_pilot": true
  },
  "input_artifacts": [],
  "loss_contract": {
    "mode": "none",
    "note": "zero-training pilot: no loss function declared"
  },
  "protocol_revision": 1,
  "regularization_contract": {
    "mode": "none",
    "note": "zero-training pilot: no regularization declared"
  },
  "resolved_hyperparameters": {
    "zero_training_pilot": true
  },
  "selection_policy": {
    "mode": "none",
    "note": "zero-training pilot: no model selection"
  },
  "source_commit": "42b26431262efdfe93766f2e3bd3d54d26999472",
  "canonical_sha256": "6bb3f473d67f2bb727394262fabbed15ba3d4bcca1f25f4bc2efa5a96bcdaa2f"
}
