{
  "critical_code": [
    "train_mpp_uni2h_mlp.py",
    "scripts/pfmval_governance.py",
    "deploy/pfmval_ops.py"
  ],
  "data_manifest_id": "barcode-repair-20260711-d626ad8-v003:1204018178a4d355",
  "data_manifest_sha256": "1204018178a4d355c2aa03314d0fafa9f0151457b9edcef3a0df9b5946c306e2",
  "experiment_id": "mpp2_huber_loss_paired_v001_20260728",
  "external_eval_policy": {
    "bootstrap_design": "resample spatial clusters with replacement within XZY; preserve all pathways and calculate paired arm deltas per replicate",
    "comparison": "XZY_spatial_cluster_bootstrap",
    "gate_change_from_xzy_allowed": false,
    "selection_or_tuning_allowed": false,
    "timing": "once_per_arm_after_checkpoint_freeze"
  },
  "feature_flags": {
    "external_xzy_selection_allowed": false,
    "implicit_retry_allowed": false,
    "repaired_data_manifest_frozen": true,
    "run_retry_requires_engineering_failure_and_unchanged_contract": true,
    "split_frozen": true
  },
  "input_artifacts": [
    {
      "artifact_id": "mpp_repair_registry",
      "sha256": "cb9565694282aee5cc56a0d02386a90b1e9db93e3f1bbe361ef055acfdc1cf18"
    },
    {
      "artifact_id": "mpp2_split_manifest",
      "sha256": "babfa2b1d9aa7d7b2e56ac0ac18b95dcb006f66a41e4a86761bbe8a746d2f824"
    },
    {
      "artifact_id": "mpp2_split_info",
      "sha256": "6d8eb6d995c3c47c3f34bb90e5db15a4322a516c860172ca5797a904514d56a9"
    },
    {
      "artifact_id": "mpp2_training_entrypoint",
      "sha256": "172c74366253349524ebafbe73b365049e457d7c34000b7baddbb2d1752f7e92"
    },
    {
      "artifact_id": "accepted_mpp2_baseline_job",
      "sha256": "5b8a5723a95dc916e007a48bdb227a23f8c428a41f93dff248d6a38f56880037"
    }
  ],
  "loss_contract": {
    "A0": {
      "loss_type": "mse",
      "reduction": "mean",
      "torch_expression": "nn.MSELoss()"
    },
    "A1": {
      "delta": 1.0,
      "loss_type": "huber",
      "reduction": "mean",
      "torch_expression": "nn.HuberLoss(delta=1.0, reduction=mean)"
    },
    "only_arm_difference": "loss_type"
  },
  "protocol_revision": 1,
  "regularization_contract": {
    "additional_loss_terms": [],
    "composite_loss": false,
    "pathway_weights": false
  },
  "resolved_hyperparameters": {
    "arms": [
      "A0_mse",
      "A1_huber_delta1"
    ],
    "batch_size": 32,
    "dropout": 0.3,
    "external_mpp_id": 2,
    "external_patient": "XZY",
    "features": "UNI2-h frozen",
    "hidden_dim": 1024,
    "lr": 0.0001,
    "max_epochs": 50,
    "min_delta": 0.0001,
    "model": "two_layer_mlp",
    "optimizer": "Adam",
    "patience": 10,
    "seed": 42,
    "train_mpp_id": 2,
    "val_strategy": "manifest"
  },
  "selection_policy": {
    "checkpoint": "each_arm_own_minimum_internal_val_loss",
    "gate_change_from_results_allowed": false,
    "internal_comparison": "patient_clustered_comparison",
    "pre_registered_metrics": [
      "legacy_pooled_pcc",
      "mean_per_pathway_pcc",
      "per_pathway_delta_pcc",
      "improved_pathway_count_and_proportion_descriptive_only",
      "raw_mae",
      "raw_r2"
    ]
  },
  "source_commit": "a04319a1d6aeafcd35d6adc7e2893f1d7b683bda",
  "canonical_sha256": "569bb6d83dcc45ef77f900d92f58645211d05702aad6cb189e00131ae08d9962"
}
